{
  "schema_version": "n5-d5-l2d-trust-anchor-registry-1.0",
  "record_kind": "VERIFIER_CONTROLLED_REPLAY_TRUST_ANCHOR_REGISTRY",
  "registry_id": "public_repository_no_l2d_production_anchor_v1",
  "production_trust_anchor_enrolled": false,
  "active_policy_pins": [],
  "claim_authorizations": {
    "real_bost_interface": false,
    "physical_forward_correctness": false,
    "derivative_correctness": false,
    "reconstruction": false,
    "algorithm_superiority": false,
    "generalization": false,
    "publication": false
  }
}
